{
  "topic": "김아이 기반 AI 업무 시스템 4시간 워크숍",
  "checkedDate": "2026-05-28",
  "claimsToAvoidReviewed": true,
  "claims": [
    {
      "id": "claim-001",
      "claim": "새 강의는 프롬프트 예문 암기가 아니라 AI 업무 시스템을 만드는 4시간 워크숍으로 설계한다.",
      "sourceType": "local",
      "useLocation": "slide",
      "confidence": "high",
      "source": "docs/harness/lecture-cuts-redesign-master-spec.md",
      "checkedDate": "2026-05-28",
      "notes": "Purpose, Global Redesign Constraints, Act 0 sections"
    },
    {
      "id": "claim-002",
      "claim": "AI 실패는 빈 목표, 빈 자료, 빈 완료 기준을 모델이 추측하면서 발생하는 절차 문제로 먼저 설명한다.",
      "sourceType": "local",
      "useLocation": "slide",
      "confidence": "high",
      "source": "lecture-cuts/slide-spec.json",
      "checkedDate": "2026-05-28",
      "notes": "02-failure-patterns, 02-1-why-llms-fail"
    },
    {
      "id": "claim-003",
      "claim": "좋은 prompt는 목표, 배경, 자료, 제약, 출력 형식, 완료 기준을 포함하는 업무 지시로 가르친다.",
      "sourceType": "local",
      "useLocation": "slide",
      "confidence": "high",
      "source": "docs/harness/lecture-cuts-redesign-master-spec.md",
      "checkedDate": "2026-05-28",
      "notes": "Act 2 Required Prompt Ingredients"
    },
    {
      "id": "claim-004",
      "claim": "컨텍스트는 현재 작업에 필요한 참고 자료이며 오래된 가정은 결과를 오염시킬 수 있다.",
      "sourceType": "local",
      "useLocation": "slide",
      "confidence": "high",
      "source": "lecture-cuts/slide-spec.json",
      "checkedDate": "2026-05-28",
      "notes": "09-context-engineering, 09-3-context-drift-check, 02-4-failure-example-context-drift"
    },
    {
      "id": "claim-005",
      "claim": "CLAUDE.md는 매번 prompt에 넣는 내용이 아니라 항상 적용되는 프로젝트 지침으로 소개한다.",
      "sourceType": "local",
      "useLocation": "slide",
      "confidence": "high",
      "source": "lecture-cuts/slide-spec.json",
      "checkedDate": "2026-05-28",
      "notes": "08-claude-md, 08-2-good-claude-md"
    },
    {
      "id": "claim-006",
      "claim": "스킬은 반복되는 업무 절차를 호출 조건, 단계, 출력 형식으로 분리하는 매뉴얼로 가르친다.",
      "sourceType": "local",
      "useLocation": "slide",
      "confidence": "high",
      "source": "lecture-cuts/slide-spec.json",
      "checkedDate": "2026-05-28",
      "notes": "10-skills, 10-1-skill-trigger-description, 11-1-real-skill-folder"
    },
    {
      "id": "claim-007",
      "claim": "Subagent는 작은 AI를 늘리는 것이 아니라 역할과 context를 분리하는 구조로 설명한다.",
      "sourceType": "local",
      "useLocation": "slide",
      "confidence": "high",
      "source": "lecture-cuts/slide-spec.json",
      "checkedDate": "2026-05-28",
      "notes": "14-subagents, 14-1-subagent-context-isolation, 14-2-reviewer-subagent-example"
    },
    {
      "id": "claim-008",
      "claim": "도구와 권한은 역할별로 좁혀 연결해야 하며 MCP는 외부 도구 연결 통로로 짧게 소개한다.",
      "sourceType": "local",
      "useLocation": "slide",
      "confidence": "high",
      "source": "lecture-cuts/slide-spec.json",
      "checkedDate": "2026-05-28",
      "notes": "18-2-tool-permissions, 18-mcp, 18-1-mcp-structure, 18-3-mcp-server-features"
    },
    {
      "id": "claim-009",
      "claim": "자동 검문소는 지시가 아니라 특정 순간에 실행되는 검증 장치로 소개한다.",
      "sourceType": "local",
      "useLocation": "slide",
      "confidence": "high",
      "source": "lecture-cuts/slide-spec.json",
      "checkedDate": "2026-05-28",
      "notes": "16-hooks, 16-4-skill-vs-hook, 17-hook-advanced"
    },
    {
      "id": "claim-010",
      "claim": "최종 하네스 구조는 정보, 지시문, 컨텍스트, 스킬, 역할/도구, 자동 검문소/평가을 반복 가능한 업무 시스템으로 연결한다.",
      "sourceType": "local",
      "useLocation": "slide",
      "confidence": "high",
      "source": "docs/harness/lecture-cuts-redesign-master-spec.md",
      "checkedDate": "2026-05-28",
      "notes": "Lecture Scope, Topic Placement, Final Harness Connection"
    }
  ]
}
